{"cpus":2,"image_lock":"example.invalid/example-web@sha256:1111111111111111111111111111111111111111111111111111111111111111","kernel_arguments_sha256":"2222222222222222222222222222222222222222222222222222222222222222","memory_mib":1024,"mounts":[{"destination":"/data","read_only":false,"source":"/example-other/data/example-web"}],"network":{"mtu":1500,"name":"example-other-network"},"preserve_application_data":true,"recovery_class":"bind-data","schema_version":1}
